source_name,title,url,pub_date,discard_reason
Hada News,"GLM으로 유명한 중국의 Z.ai, IPO 진행 $560M 이상의 가치",https://news.hada.io/topic?id=25658,2026-01-08,"IPO and funding announcement about Z.ai, no technical AI content or usage examples"
Hada News,NIA가 전망한 2026년 12대 AI·디지털 트렌드 [28p PDF],https://news.hada.io/topic?id=25657,2026-01-08,"Market trends and forecasts for 2026 AI/digital trends, predictive analysis without technical substance"
Hada News,Show GN: 아고다 파인더 - CID 분석으로 찾는 숙박비 절약의 기술,https://news.hada.io/topic?id=25655,2026-01-08,"Product recommendation/review about Agora Finder service, not AI/ML related"
Hada News,Shipmap.org,https://news.hada.io/topic?id=25654,2026-01-08,"Data visualization tool about shipping routes, not AI/ML specific content"
Hada News,진짜 음식을 먹자,https://news.hada.io/topic?id=25653,2026-01-08,"Health/nutrition content about US dietary guidelines, non-AI topic"
Hada News,"미국, 월가 기관투자자의 단독주택 매입 금지 발표",https://news.hada.io/topic?id=25652,2026-01-08,"Real estate/housing policy news, non-AI topic"
Hada News,설탕 산업이 연구자들에게 영향을 미쳐 지방을 심혈관 질환의 원인으로 돌림 (2016),https://news.hada.io/topic?id=25651,2026-01-08,"Health/nutrition history about sugar industry and health effects, non-AI topic"
Hada News,Biscuit - PostgreSQL에서 LIKE / ILIKE 패턴 검색을 고속화하기 위한 전용 인덱스,https://news.hada.io/topic?id=25649,2026-01-08,"PostgreSQL database optimization technique, general database topic not AI/ML specific"
